comment,label
"✨ Miếng dán trắng răng an toàn từ Mỹ ✨ Răng trắng bật 2-3 tông chỉ sau 1 liệu trình. Đang sale 50%, dr mình ngay nhé.",1
Review công ty Shopee vị trí intern marketing đi mng. Môi trường có ổn không ạ?,0
"Nhận order sỉ lẻ khô gà lá chanh, da heo cháy tỏi. 🌶️ Đồ nhà làm, đảm bảo an toàn vệ sinh. Freeship từ 3 hộp.",1
Mày bị ảo tưởng sức mạnh à? Bớt bớt lại đi.,0
"Đậu môn tư tưởng rồi chúng mày ơi, mừng quá 😂",0
"Bán voucher nghỉ dưỡng FLC 2N1Đ giá rẻ. Hạn sử dụng còn dài, áp dụng cuối tuần. Ai cần ib mình.",1
"Có ai biết cách đăng ký học vượt không, chỉ mình với.",0
Cần tìm một bạn biết chụp ảnh để đi lang thang Hà Nội cuối tuần.,0
Nói chuyện mà cứ như bố đời người ta.,0
"💰 Việc làm thêm cho các bạn sinh viên rảnh rỗi. Chỉ cần online chốt đơn, hoa hồng 10-20% trên mỗi đơn hàng. Không cọc, không vốn.",1
Ngày hội hiến máu của trường mình tổ chức khi nào vậy mng?,0
Góc cảnh báo lừa đảo: Mọi người cẩn thận với tài khoản X chuyên lừa cọc tiền phòng trọ nhé.,0
"Bên mình có nhận làm dấu thực tập cho các bạn sinh viên. Nhanh chóng, tiện lợi, giá hạt dẻ.",1
"Có ai tham gia cuộc thi ""Sinh viên thanh lịch"" của trường không?",0
Cần tìm người share tiền mua tài khoản Coursera Plus để học.,0
"Nhận chạy quảng cáo Facebook, Tiktok ra đơn cho các shop online. Cam kết hiệu quả, giá cạnh tranh.",1
Mai thi rồi mà giờ vẫn chưa học chữ nào. Toang thật rồi 🥲.,0
Thằng bạn thân vừa bị người yêu cắm sừng. Giờ đang ngồi an ủi nó.,0
Pass lại vé xe giường nằm về Nghệ An ngày 28 Tết. Do mình đổi lịch về sớm hơn. Giá gốc.,1
Môn Vi điều khiển có khó không các anh chị K65?,0
Logic của mày có vấn đề à? Nói trước quên sau.,0
"Bán tài khoản Zoom Pro không giới hạn thời gian. Phù hợp cho các bạn học nhóm, họp online. Giá 50k/tháng.",1
Lịch nghỉ đông của trường có chưa ạ?,0
Có ai biết app nào dịch tiếng Anh chuyên ngành tốt không?,0
Tuyển CTV viết bài chuẩn SEO cho website. Nhuận bút 50-100k/bài tùy độ khó. Yêu cầu có laptop và chăm chỉ.,1
"Lại sắp đến hạn đóng tiền nhà rồi, áp lực quá.",0
"Cái kết phim xàm ghê, phí cả thời gian xem.",0
"GOM ORDER CHÂN GÀ SỐT THÁI 🌶️ Chân to, giòn sần sật. 50k/hộp 500gr. Chiều mai mình ship nhé.",1
Có ai đi xem triển lãm ở trung tâm hội nghị quốc gia không?,0
Mày là thánh phán à? Chuyện gì cũng biết.,0
"Nhận in ốp lưng điện thoại theo yêu cầu. In mọi hình ảnh, logo. Bền đẹp, không phai màu. Chỉ từ 49k.",1
Ở cổng sau trường có quán bún chả nào ngon không mng?,0
Tìm đồng đội lập team tham gia cuộc thi Robocon.,0
"Bạn muốn kiếm 200-500k mỗi ngày? Việc nhẹ nhàng, làm tại nhà. Ib mình để được hướng dẫn chi tiết, không lừa đảo.",1
Thèm tokbokki phô mai quá chúng mày ơi.,0
"Hôm nay đi học quên không mang tiền mặt, may mà có đứa bạn cho vay. Quý hóa quá 🙏.",0
"Pass lại đôi giày Dr. Martens auth do đi không hợp. Size 38, mới 98%, giá 1tr5 có fix.",1
Học ngành Marketing có cần ngoại hình không ạ?,0
Crush vừa xem story của mình. Tim đập thình thịch luôn 💕.,0
"Chuyên cung cấp tài khoản game steam, origin giá rẻ hơn store. Full game bản quyền.",1
Môn Tâm lý học có dễ qua không mng?,0
Cmt để lưu lại bài viết hay.,0
"Bán bộ dụng cụ học tập (thước kẻ, compa, eke) kỹ thuật. Mới 100%. Mua 200k pass 120k.",1
Bạn cùng phòng hay dẫn người yêu về ngủ lại. Khó xử vcl.,0
Bị rớt visa du học. Buồn quá không biết làm gì.,0
"Nhận làm video highlight bóng đá, video tiktok. 🔥 Chuyên nghiệp, nhanh chóng. Ib để xem sản phẩm.",1
Học tín chỉ GDQP ở đâu vậy mng?,0
Mày bớt sân si lại đi thì cuộc sống sẽ tốt đẹp hơn đấy.,0
Tham gia nhóm đầu tư chứng khoán cho sinh viên. 📈 Được chuyên gia hỗ trợ 1-1. Link tham gia ở bio.,1
Có ai biết quán cafe nào có nhiều mèo không ạ?,0
"Ad cho em đăng bài tìm người thân với ạ. Em tìm bạn học cùng cấp 3, mất liên lạc lâu rồi.",0
Bán tài khoản Elsa Speak Pro học tiếng Anh trọn đời. Giá chỉ bằng 1/5 giá gốc.,1
"Sắp ra trường rồi, có chút bồi hồi.",0
Có ai biết chỗ nào bán bánh gối ngon không?,0
"Tuyển mẫu make up cho lớp học trang điểm cá nhân. ✨ Hoàn toàn miễn phí, được chụp ảnh xinh mang về.",1
"Lại phải học lại rồi, tốn tiền quá 😭.",0
"Bài viết này phân tích phiến diện, thiếu căn cứ.",0
"Nhận sửa máy tính, cài win tại nhà. 💻 Nhanh chóng, uy tín, giá sinh viên. Có mặt sau 30 phút.",1
Có ai biết cách xin gia hạn học phí không ạ?,0
"Mọi người ơi, môn Cấu trúc dữ liệu và giải thuật có nặng lắm không ạ? Em hơi yếu code.",0
🔥 Bán bộ 2000+ font chữ việt hóa cho dân thiết kế. Trọn bộ chỉ 39k. Chuyển khoản nhận link google drive ngay.,1
Đứa nào ở phòng 402 KTX B5 làm ơn vứt rác đúng chỗ dùm cái. Bừa bộn không thể chịu nổi. 😠,0
"Nhận làm báo cáo thực tập, chuyên đề tốt nghiệp các ngành kinh tế. Cam kết đúng deadline, chuẩn format, không đạo văn.",1
Có ai biết chỗ nào gội đầu massage ổn áp gần trường không ạ?,0
Điểm danh cái nhẹ rồi trốn về thôi anh em ơi 😂.,0
"Tuyển nhân viên bán hàng cho shop giày sneaker. 👟 Lương 25k/h + thưởng doanh số. Yêu cầu nhanh nhẹn, trung thực.",1
Review giảng viên hướng dẫn khóa luận khoa Công nghệ thông tin đi mng.,0
"Mình có nhận order bánh tráng cuốn, bánh tráng trộn. Đầy đủ topping, 25k/suất. Ib mình để đặt nhé.",1
Mày không có não hay sao mà comment câu đó?,0
Cuối cùng cũng bảo vệ thành công đồ án. Nhẹ cả người 🙏.,0
SALE SỐC‼️ Áo phông local brand đồng giá 150k. Mua 2 freeship. Check ngay gian hàng của mình nhé.,1
Có ai biết cách đăng ký thi chứng chỉ tiếng Nhật JLPT online không?,0
"Cần tìm một bạn nữ hiền lành, sạch sẽ ở ghép quận Đống Đa. Phòng 3tr/tháng chia đôi.",0
Nhìn cái mặt đã thấy không có thiện cảm rồi.,0
"Bạn đang gặp khó khăn tài chính? 💸 Hỗ trợ vay sinh viên lãi suất thấp, không cần thẩm định. Giải ngân trong 1 nốt nhạc.",1
"Mọi người ơi, lịch thi đấu giải bóng đá sinh viên có chưa ạ?",0
Góc pass đồ: Mình pass lại cái bàn học gấp thông minh còn mới 99%. Mua 300k pass 180k.,0
"Tinh chất mọc tóc, trị hói gia truyền. Hiệu quả thấy rõ sau 1 tháng. Ib để được tư vấn miễn phí.",1
Có ai tham gia CLB nhiếp ảnh của trường không cho em xin ít review với ạ.,0
Cần tìm người share tiền mua vé máy bay đi Đà Nẵng tháng tới để săn được vé rẻ.,0
"Nhận xem chỉ tay, tướng số qua ảnh. ✋ Xem vận mệnh, tình duyên, sự nghiệp. Phí tùy tâm sau khi xem.",1
"Wifi trên thư viện yếu vcl, load mãi không xong cái video bài giảng.",0
Thằng bạn thân có bồ xong bơ mình luôn. Chơi với nó từ hồi cởi truồng tắm mưa... 🥲,0
"Pass lại 2 vé xem phim ""Mai"" suất chiếu tối nay. Do mình có việc bận. Giá rẻ hơn ở rạp.",1
Môn Triết học có được mang Atlat vào phòng thi không ạ? 🤔,0
Nói chuyện mà cứ cà khịa là giỏi.,0
"Bán tài khoản Youtube Premium, xem video không quảng cáo, nghe nhạc tắt màn hình. 40k/tháng.",1
Lịch học quân sự đợt này ở đâu vậy mng?,0
Có ai biết cách fix lỗi máy tính bị màn hình xanh không?,0
"Tuyển 15 bạn làm cộng tác viên cho các dự án NFT. 🚀 Không cần vốn, chỉ cần chăm chỉ học hỏi. Cơ hội X100 tài sản.",1
"Lại sắp đến hạn nộp học phí rồi, chưa dám xin tiền bố mẹ.",0
Cái giọng của bà này nghe khó chịu thật sự.,0
"GOM ORDER SỮA TƯƠI TRÂN CHÂU ĐƯỜNG ĐEN 흑당 버블티. 🥤 Chuẩn vị Đài Loan, 30k/cốc. 3h chiều mình ship nhé.",1
Có ai đi xem kịch ở Nhà hát Lớn bao giờ chưa?,0
Mày bớt thể hiện đi được không?,0
"Nhận rửa xe, thay dầu, bảo dưỡng xe máy tại nhà. 🛵 Tiện lợi, uy tín, giá cả phải chăng.",1
Ở KTX có chỗ nào cho nấu ăn riêng không ạ?,0
Tìm đồng đội tối nay đi ăn phở cuốn Ngũ Xã.,0
Bạn muốn nói tiếng Trung như gió? Đăng ký ngay khóa học giao tiếp với người bản xứ. Giảm 50% cho SV.,1
Thèm nem lụi Huế quá chúng mày ơi.,0
Đi học về thấy mẹ gửi đồ ăn lên. Hạnh phúc giản đơn. ❤️,0
"Pass lại cuốn sách ""Nhà giả kim"" còn mới tinh. Mua 80k pass 50k.",1
Học ngành Kế toán có cần giỏi excel không ạ?,0
Crush vừa trả lời tin nhắn của mình. Chắc đêm nay mất ngủ. 🥰,0
Chuyên cung cấp tài khoản game bản quyền trên Steam với giá rẻ hơn 70%. Ib để check game bạn cần.,1
Môn Quản trị học có dễ lấy điểm A không mng?,0
Hóng link full không che.,0
"Bán balo chống trộm, chống nước, có cổng sạc USB. ✨ Siêu tiện lợi cho các bạn hay di chuyển. Giá chỉ 299k.",1
Bạn cùng phòng hay nghe nhạc bằng loa ngoài. Nói mấy lần không được.,0
"Chia tay rồi, làm sao để quên người yêu cũ đây mọi người?",0
"Nhận làm tour du lịch, teambuilding cho các lớp, CLB. 🌴 Lịch trình hấp dẫn, giá cả sinh viên.",1
Chỗ gửi xe của trường có nhận trông qua đêm không ạ?,0
Mày bớt tỏ ra mình là nạn nhân đi.,0
"Tham gia nhóm chia sẻ tài liệu học tập, slide bài giảng free. Link ở bio.",1
Có ai biết quán cafe sách nào yên tĩnh ở khu vực Ba Đình không?,0
Ad cho em đăng bài pass lại mấy bộ đồ mặc không vừa với ạ.,0
Bán tài khoản Duolingo Plus học ngoại ngữ không giới hạn. Trọn đời chỉ 150k.,1
Sắp 4 năm đại học rồi mà vẫn chưa biết mình thích gì.,0
Có ai biết chỗ nào bán bún đậu mắm tôm ngon mà nhiều topping không?,0
Tuyển nhân viên thu ngân cho siêu thị mini. Có thể xoay ca linh hoạt. Lương 20k/h.,1
"Lại một kỳ nữa phải học online rồi, chán thật.",0
Bài viết này như kiểu google dịch ấy nhỉ?,0
"Nhận khắc laser lên bút, ví da, móc khóa làm quà tặng. 🎁 Lấy ngay sau 5 phút. Giá chỉ từ 30k.",1
Có ai biết cách xin bảng điểm online không ạ?,0
"Mọi người ơi, phòng y tế của trường mình có khám BHYT không ạ?",0
"🔥 XẢ KHO GIÀY DÉP MÙA HÈ - ĐỒNG GIÁ 79K 🔥 Sandal, dép lê, sục đủ mẫu. Nhanh tay vào link bio săn sale nhé!",1
"Cần tìm 2 bạn nam ở ghép khu vực Mỹ Đình. Phòng 2tr8/tháng, có nóng lạnh điều hòa, không chung chủ. Yêu cầu gọn gàng.",0
"Bạn muốn kiếm 1-2 triệu/tháng chỉ bằng việc lướt Tiktok? 📱 Ib mình để nhận link app, không đa cấp, không lừa đảo.",1
Đứa nào học lớp Marketing căn bản chiều nay có thấy cái tai nghe Airpods pro ở bàn 3 không? Cho mình xin lại với 😭.,0
Có ai biết cách đăng ký tình nguyện viên cho Sea Games không ạ?,0
"Nhận order trà mãng cầu, trà dâu hot hit. 🍓 Quả tươi mỗi ngày, đảm bảo ngon. 35k/ly, ship từ 2 ly.",1
Review trung tâm tiếng Anh Ila đi mng. Học phí có đắt không ạ?,0
"Bán tài khoản ChatGPT 4.0 Plus giá rẻ. Hỗ trợ làm bài tập, viết code, content. 🤖 Dr mình để được tư vấn.",1
Mày đọc có hiểu tiếng người không vậy?,0
Bảo vệ thành công khóa luận tốt nghiệp rồi. Cảm ơn thầy cô và bạn bè rất nhiều ❤️.,0
"Tuyển nhân viên pha chế, thu ngân cho quán trà sữa. Lương 23k/h, có thể xoay ca theo lịch học. 🥤",1
Có ai biết cách xin giấy xác nhận sinh viên để giảm giá vé tàu không?,0
Cần tìm một bạn biết chơi piano để đệm cho mình hát trong đêm nhạc hội.,0
Nhìn cái cách nói chuyện đã thấy không ưa nổi rồi.,0
"Dịch vụ tăng follow, like, comment cho Instagram, Facebook, Tiktok. 🚀 Giúp bạn trở thành hot face. Uy tín, giá rẻ.",1
"Mọi người ơi, website của phòng đào tạo lại không vào được rồi à?",0
Góc pass đồ: Mình pass lại cái máy ảnh film còn dùng tốt. Tặng kèm 1 cuộn film. Giá 500k.,0
"Bạn nào bị thâm mắt, bọng mắt, nếp nhăn thì về đội em. Kem mắt AHC cam kết hiệu quả sau 14 ngày. ✨",1
Có ai tham gia CLB Sách và Hành động không cho em xin ít review với.,0
Cần tìm người share tiền phòng khách sạn đi Vũng Tàu cuối tháng này.,0
"Nhận làm powerpoint, slide thuyết trình. 💻 Đẹp, chuyên nghiệp, sáng tạo. Giá chỉ từ 8k/slide.",1
Trời nồm ẩm quần áo phơi mãi không khô. Khó chịu vcl. 😠,0
Thằng bạn mượn tiền mình từ đầu kỳ mà giờ cuối kỳ rồi chưa thấy trả.,0
Pass lại vé concert BLACKPINK tại Thái Lan. Do mình không xin được visa. Giá gốc + phí ship.,1
Môn Hệ quản trị cơ sở dữ liệu có cần laptop cấu hình cao không ạ?,0
Mày bớt dạy đời người khác đi.,0
"Bán 10.000+ khóa học online đủ mọi lĩnh vực. 📚 Marketing, IT, Design... Trọn bộ chỉ 199k. Ib để nhận list khóa học.",1
Lịch thi kết thúc học phần có trên trang tín chỉ chưa mng?,0
"Có ai biết cách dùng hàm Vlookup trong excel không, chỉ mình với huhu.",0
"Bạn muốn trở thành affiliate marketer? 🔥 Tuyển CTV bán các khóa học online, hoa hồng lên đến 60%. Không cần vốn.",1
"Lại sắp đến hạn nộp báo cáo thực tập rồi, vẫn chưa xin được chữ ký.",0
Cái giọng lồng tiếng phim này nghe chán thật sự.,0
"GOM ORDER BÁNH MÌ CHẢO. 🍳 Suất đầy đủ 30k (pate, trứng, xúc xích). 7h sáng mai mình ship.",1
Có ai đi xem giải Vovinam của trường mình không?,0
Mày tưởng mày là ai mà có quyền phán xét người khác?,0
"Nhận sửa chữa, vệ sinh máy lạnh, quạt hơi nước tại nhà. ❄️ Nhanh chóng, sạch sẽ, giá sinh viên.",1
Ở KTX có được phép dùng bếp từ mini không ạ?,0
Tối nay có ai đi lượn phố đi bộ không?,0
"Bạn muốn cải thiện kỹ năng giao tiếp? Đăng ký ngay khóa học MC, kỹ năng mềm. Giảm 40% cho nhóm 3 người.",1
Thèm bánh tráng nướng Đà Lạt quá chúng mày ơi. 😭,0
Đi học về mệt mà thấy bạn cùng phòng nấu sẵn cơm cho. Cảm động thực sự. 🥰,0
Pass lại con máy đọc sách Kindle còn mới. Mua về mà lười đọc. Giá 1tr8.,1
Học ngành Ngôn ngữ Nhật ra trường có cần bằng N mấy ạ?,0
Crush vừa follow instagram của mình. Có nên chủ động nhắn tin không nhỉ? 🤔,0
"Chuyên cung cấp key Windows, Office, phần mềm diệt virus bản quyền. Rẻ hơn mua trực tiếp 80%.",1
Môn Logic học có khó không mng?,0
"Bài viết này chất lượng quá, cảm ơn ad.",0
Bán tài khoản VIP FPT Play xem bóng đá C1. ⚽️ Rẻ hơn đăng ký trực tiếp. Ib để chốt.,1
Bạn cùng phòng hay lấy đồ của mình dùng mà không hỏi. Khó chịu nhưng ngại nói.,0
Bị từ chối học bổng du học. Cảm thấy cả thế giới sụp đổ.,0
"Nhận làm phụ đề (subtitle) cho video, phim ảnh. 🎞️ Dịch chuẩn, khớp time. Giá cả thương lượng.",1
Chỗ photo ở gần cổng trường có in màu không ạ?,0
Mày bớt tỏ vẻ hiểu biết đi.,0
"Tham gia nhóm chia sẻ kinh nghiệm apply học bổng, du học. Link ở bio nhé. ✈️",1
Có ai biết quán cafe nào có board game ở khu vực Cầu Giấy không?,0
Ad cho em đăng bài tìm mèo lạc với ạ. Em làm mất 1 bé mèo ta màu vàng ở KTX.,0
"Bán tài khoản Grammarly Premium check ngữ pháp, đạo văn. Siêu cần thiết cho các bạn học tiếng Anh. ✍️",1
Sắp hết 4 năm mà vẫn chưa có người yêu.,0
Có ai biết chỗ nào bán bún bò Huế chuẩn vị không?,0
"Tuyển cộng tác viên review sản phẩm, mỹ phẩm. 💄 Được dùng sản phẩm miễn phí + nhận hoa hồng.",1
Lại một kỳ nữa phải đóng tiền học lại. Buồn của tôi. 🥲,0
"Bài viết này phân tích sơ sài quá, chưa tới.",0
"Nhận bọc sách vở, dán bìa plastic cho học sinh, sinh viên. 📚 Cẩn thận, đẹp, lấy ngay.",1
Có ai biết cách xin giấy chứng nhận tham gia hoạt động ngoại khóa không ạ?,0
"Mọi người ơi, môn học nào tự chọn của khối C là dễ qua nhất ạ? Em cần kéo GPA.",0
"🔥 VÉ MÁY BAY 0Đ SĂN SALE NỬA ĐÊM 🔥 Book vé du lịch hè ngay thôi. Mình có nhận săn vé giá rẻ, phí chỉ 50k/vé.",1
"Tìm 1 bạn nam ở ghép khu vực Thanh Xuân. Phòng 2tr4, điện nước giá dân, giờ giấc tự do. Yêu cầu không hút thuốc, sạch sẽ.",0
"Chỉ cần online 1-2h mỗi ngày, kiếm 3-4 triệu/tháng. 💸 Công việc đăng bài, tư vấn sản phẩm. Không vốn, không cọc. Ib mình để được hướng dẫn.",1
Đứa nào để cái xe đạp không khóa ở nhà xe G. Cẩn thận mất đấy.,0
Có ai biết chỗ nào bán đồ ăn vặt Hàn Quốc chuẩn vị không ạ?,0
"Son Black Rouge, 3CE đồng giá 129k. 💄 Hàng auth check code thoải mái. Mua 2 thỏi freeship. Dr mình để xem bảng màu nhé.",1
Review CLB Kỹ năng mềm của trường mình đi ạ. Em là tân sinh viên muốn tham gia.,0
"Bán tài khoản VIP VieON, K+ xem phim, bóng đá. ⚽️ Chất lượng full HD, không giật lag. Giá chỉ từ 30k/tháng.",1
Mày học lại môn văn đi rồi hẵng comment nhé.,0
Trượt môn chuyên ngành. Cảm giác thật tồi tệ. 😞,0
"Tuyển nhân viên soát vé cho rạp chiếu phim. Lương 25k/h, được xem phim miễn phí. Yêu cầu trung thực, nhanh nhẹn.",1
Có ai biết cách xin giấy chứng nhận là sinh viên để mua vé xe bus tháng không ạ?,0
Cần tìm một bạn biết edit video bằng Premiere để làm bài tập nhóm.,0
Nhìn cái avatar đã thấy không muốn tranh luận rồi.,0
"Dịch vụ seeding, tăng tương tác cho bài viết, fanpage. 🚀 Giúp bài viết của bạn lên top. Giá cả phải chăng, ib để được báo giá.",1
"Mọi người ơi, điểm thi giữa kỳ có cập nhật trên app của trường chưa ạ?",0
Góc pass đồ: Mình pass lại cái giá sách 5 tầng còn mới. Mua 400k pass 250k. Mình ở gần trường.,0
"Bạn nào bị viêm da cơ địa, á sừng, vảy nến thì đừng bỏ qua bài thuốc nam gia truyền này nhé. Cam kết hiệu quả.",1
"Có ai tham gia cuộc thi ""Olympic Kinh tế học"" của trường không?",0
Cần tìm người share tiền mua account Figma Pro cho nhóm làm UI/UX.,0
"Nhận thiết kế CV, portfolio, profile cá nhân. ✨ Chuyên nghiệp, ấn tượng, giúp bạn ghi điểm với nhà tuyển dụng.",1
Lại sắp đến deadline đóng tiền điện nước rồi. Ví lại mỏng đi. 🥲,0
Bạn thân nhất của mình sắp đi du học. Cảm thấy buồn và hụt hẫng.,0
Pass lại voucher ăn buffet Dookki. Hạn sử dụng còn 1 tháng. Mua 139k pass 100k.,1
Môn Kỹ thuật phần mềm có nặng về lý thuyết không ạ?,0
Mày bớt sân si chuyện của người khác đi được không?,0
"Bán 1000+ template Powerpoint, Keynote, Google Slides. 💻 Đầy đủ các chủ đề. Trọn bộ chỉ 99k.",1
Lịch tốt nghiệp đợt 2 có chưa mng?,0
Có ai biết cách khôi phục file word chưa kịp lưu mà máy bị sập nguồn không? Cứu em với. 😭,0
"Tuyển cộng tác viên dịch truyện, phim (Anh - Việt). ✍️ Yêu cầu tiếng Anh tốt, chăm chỉ. Nhuận bút tính theo sản phẩm.",1
Lại một kỳ nữa qua đi mà vẫn chưa có mảnh tình vắt vai. FA muôn năm.,0
Cái kết của bộ phim này vô lý thật sự.,0
"GOM ORDER CƠM CHÁY CHIÊN MẮM HÀNH. 🍚 Giòn rụm, đậm vị. 25k/túi 200gr. Chiều mai mình ship nhé.",1
Có ai đi xem show của Hà Anh Tuấn tối nay không?,0
Mày tưởng mày là ai mà lên mặt dạy bảo tao?,0
"Nhận lắp đặt, sửa chữa wifi, mạng LAN tại nhà. 🌐 Nhanh chóng, chuyên nghiệp, giá sinh viên.",1
Ở KTX có được mang nồi lẩu mini vào dùng không ạ?,0
Tối nay có ai đi dạo hồ Gươm không?,0
Bạn muốn tự tin thuyết trình trước đám đông? Đăng ký ngay khóa học kỹ năng mềm. Giảm 30% khi đăng ký trước ngày X.,1
Thèm chè khúc bạch quá chúng mày ơi.,0
Hôm nay lên thư viện gặp crush. Cả ngày vui vẻ. 😊,0
"Pass lại con tai nghe Sony WH-1000XM4 full box, còn bảo hành. Ít dùng nên còn mới. Giá 4tr5.",1
Học ngành Quan hệ công chúng có cần phải năng động lắm không ạ?,0
Crush vừa rep story mình bằng sticker. Có ý gì không nhỉ? 🤔,0
"Chuyên cung cấp tài khoản game pass, PC game pass giá rẻ. Chơi hàng trăm game bản quyền chỉ với 50k/tháng.",1
Môn Kinh tế chính trị Mác Lênin có dễ học không mng?,0
Bài này phân tích sâu sắc quá.,0
"Bán tài khoản VIP Elsa Speak, Memrise, Busuu học ngoại ngữ. 🌍 Giá sinh viên. Ib để chốt.",1
Bạn cùng phòng hay đi chơi về khuya làm mình mất ngủ.,0
Thi trượt bằng lái xe máy lần thứ 2. Chán không buồn nói.,0
"Nhận viết content, quản lý fanpage cho các shop. ✍️ Nội dung sáng tạo, thu hút khách hàng. Giá cả thương lượng.",1
Chỗ giữ xe ở nhà D có làm việc cuối tuần không ạ?,0
Mày bớt tỏ ra mình là người bị hại đi.,0
Tham gia nhóm chia sẻ kinh nghiệm săn học bổng chính phủ. Toàn các pro thôi. Link ở bio.,1
Có ai biết quán cafe nào có view sân thượng đẹp ở khu vực Hà Đông không?,0
"Ad cho em đăng bài tìm người ở ghép với ạ. Em là nữ, sv năm 2.",0
"Bán tài khoản Turnitin check đạo văn. 📝 Cần thiết cho các bạn làm bài tập lớn, khóa luận. 20k/lượt check.",1
"Sắp 20/10 rồi, nên tặng quà gì cho mẹ và cô giáo đây nhỉ?",0
Có ai biết chỗ nào bán bún riêu cua ngon ở gần đây không?,0
"Tuyển cộng tác viên bán mỹ phẩm xách tay. 💄 Chiết khấu cao, không cần bỏ vốn. Được training về sản phẩm.",1
Lại một kỳ nữa phải học online. Tương tác với thầy cô bạn bè chán ghê. 😩,0
"Bài viết này dịch word-by-word, đọc ngang phè.",0
"Nhận order quần áo Taobao, 1688, Pinduoduo. 👕 Công rẻ, hàng về nhanh. Chốt đơn mỗi ngày.",1
Có ai biết cách xin cấp lại mật khẩu tài khoản sinh viên không ạ?,0
"Mọi người ơi, lên phòng công tác sinh viên xin dấu có cần mang theo thẻ sinh viên không ạ?",0
"⚽️ NHẬN IN ÁO LỚP, ÁO NHÓM, ÁO CLB ⚽️ Vải cotton co giãn, in sắc nét không bong tróc. Thiết kế miễn phí. Ib để nhận báo giá.",1
Cần tìm người đi ăn sập phố Tạ Hiện tối nay. Mình bao kèo đầu. 😂,0
"Bạn đang ĐAU ĐẦU vì deadline? 🤯 Nhận làm assignment, research paper, thesis... mọi chuyên ngành. Uy tín, bảo mật, check turnitin <10%.",1
Đứa nào ở ktx mà đêm hôm còn bấm game kêu lạch cạch vậy. Vô ý thức vcl. 😠,0
Có ai biết chỗ nào bán xôi chiên ngon ở gần đây không?,0
"Bán tài khoản VIP TestKing, Acloud Guru cho dân IT. 👨‍💻 Full khóa học, lab thực hành. Giá chỉ bằng 1/10 giá gốc.",1
Review CLB Guitar của trường mình đi ạ. Có cần biết chơi đàn trước khi vào không?,0
"Nhận order bánh crépe sầu riêng, bánh mousse. 🍰 Bánh tươi mỗi ngày. Ship hỏa tốc nội thành.",1
Nhìn cái mặt đã thấy gian rồi.,0
Cuối cùng cũng qua môn xác suất thống kê. Hú hồn. 🙏,0
"Tuyển cộng tác viên review, unbox sản phẩm công nghệ. 📱 Được trải nghiệm sản phẩm mới miễn phí + có nhuận bút.",1
Có ai biết cách xin học bổng khuyến khích học tập của khoa không?,0
"Cần tìm một bạn nữ làm mẫu ảnh cho BST áo dài Tết. Yêu cầu cao trên 1m6, tóc dài.",0
Nói chuyện mà cứ như mình biết tuốt ấy nhỉ.,0
"Dịch vụ phá mật khẩu điện thoại, máy tính. 🔐 Lấy lại dữ liệu an toàn, nhanh chóng. Dr để được tư vấn.",1
