comment,label
Có ai biết quán net nào ở gần trường có máy ngon để chơi Elden Ring không?,0
Con đĩ đấy cặp với cả thầy giáo mà vẫn ra vẻ thanh cao được. Tởm vcl.,0
Deadline dí đến đít rồi mà vẫn chưa có hứng làm. 🥲,0
Có ai biết cách xin miễn giảm môn GDQP không ạ? Em có chứng chỉ rồi.,0
Mày với nó đúng là một cặp trời sinh. Ngu và nguy hiểm.,0
"Nhận order giày sneaker rep 1:1, full box + bill. 👟 Hàng về sau 7-10 ngày. Check dr để xem feedback.",1
Đứa nào có link tải full bộ giáo trình của khoa mình không cho tao xin với.,0
"Cái thằng báo thủ, đi học thì không đi, đến lúc thi thì chép bài tao. Đm.",0
Có ai biết chỗ nào bán chân gà nướng ngon ở khu Hồ Tùng Mậu không?,0
"Cứu, mai thi vấn đáp mà giờ chữ đéo nào cũng không vào đầu.",0
"Pass lại vé xem bóng đá trận Việt Nam - Thái Lan. Khán đài B, giá gốc.",1
Mày là cái đéo gì mà dám chửi bạn tao? Thích solo không?,0
Học lại tốn tiền vcl. Xót cả ruột.,0
"Mọi người ơi, quán cơm gần cổng trường có tăng giá không ạ?",0
Cái loại rẻ rách như mày thì chỉ có đi lừa người khác là giỏi.,0
Có ai biết cách xin giấy xác nhận sinh viên online không ạ?,0
"Bạn nào cần người đi chợ, nấu cơm hộ thì ib mình nhé. 👩‍🍳 Giá sinh viên, đảm bảo ngon sạch.",1
"Dm thằng nào hút thuốc trong thang máy KTX, ám hết cả mùi vào người tao.",0
Có ai biết thủ tục xin ra khỏi đoàn trường không?,0
Mày bớt sủa bậy đi được không? Đéo ai quan tâm đâu.,0
Chạy xong deadline chắc tao đột quỵ. Mệt vcl.,0
"Bạn muốn kiếm 100-200k/ngày? 💸 Công việc xem video, thả tim. Rút tiền về Momo. Ib mình để được hướng dẫn.",1
Thi lại môn Triết. Cuộc đời thật trớ trêu. 😩,0
Thằng đấy gay lọ mà cứ thích đi gạ con gái. Bệnh hoạn vcl.,0
Cái thằng óc chó nào chấm bài tao môn Triết mà cho 5 điểm vậy? Bài làm dài vl mà điểm như cc.,0
"🔥 NHẬN LÀM BẰNG LÁI XE A1, B2 BAO ĐẬU 🔥 Không cần thi, có hồ sơ gốc. Uy tín, kín đáo. Ib Zalo: 09xx.xxx.xxx",1
"Đm con ml lớp phó học tập, hỏi nó cái gì cũng vênh cái mặt lên như bố đời. Ghét vcl.",0
Bán full bộ tài liệu ôn thi TOEIC 900+. 📚 File PDF + Audio + App. Trọn bộ chỉ 99k. Cam kết không hiệu quả refund.,1
Tối nay có kèo nhậu không chúng mày? Chán quá.,0
"Tuyển 20 bạn nữ PG cho sự kiện game. Yêu cầu ngoại hình xinh, cao >1m65. Lương 1 củ/ngày. Dr gửi info + ảnh. 💃",1
Mày là cái thá gì mà dám lên mặt dạy khôn tao? Ngu thì câm mẹ mồm vào.,0
Link xem full clip em gái sinh viên lộ hàng cực nét. 🔞 Link ở bio của mình nhé ae.,1
Học xong môn này tao cảm thấy đầu óc mình bị ngu đi hẳn.,0
Có ai biết chỗ nào bán mì cay ngon ở khu vực Hà Đông không ạ?,0
"NHẬN HACK LIKE, FOLLOW FACEBOOK, TIKTOK. 🚀 Giá rẻ nhất thị trường. Giúp bạn sống ảo thành công. Ib để được báo giá.",1
"Cái thằng lồn phòng bên cạnh đêm nào cũng dẫn gái về phòng làm ồn, đéo cho ai ngủ.",0
VAY TIỀN ONLINE LÃI SUẤT 0%. 💸 Chỉ cần thẻ SV hoặc CMND. Giải ngân sau 3 phút. Bấm vào link để vay ngay.,1
Đm lại rớt môn. Tốn tiền học lại vcl.,0
Có ai có đề thi cuối kỳ môn CSDL của thầy Tuấn năm ngoái không cho mình xin với. 🙏,0
"Nhóm kéo Baccarat, Tài Xỉu. 💰 Vốn ít húp nhiều, cam kết về bờ an toàn. Ae xa bờ mau vào nhóm.",1
"Con đĩ đấy thảo mai vcl, trước mặt thì chị em sau lưng thì đâm chọt.",0
"Pass lại con acc Genshin Impact full waifu, nhiều vũ khí 5 sao. Tâm huyết nên giá hơi cao. Ib thương lượng.",1
"Mày ăn nói như một thằng vô học, bố mẹ mày đéo dạy mày à?",0
Deadline ngập mặt mà vẫn phải đi làm thêm. Kiếp sv khổ như chó.,0
"Cần tìm người share phòng trọ khu vực Chùa Láng, 2tr/người. Yêu cầu sạch sẽ.",0
"Bán tài khoản VIP Onlyfans, Fansly. 🥵 Full clip, ảnh HD. Giá chỉ 50k/tháng. Dr để chốt lẹ.",1
"Đm thầy giáo dạy như cc, chả hiểu con mẹ gì.",0
"Tuyển CTV bán mỹ phẩm, chiết khấu 30-40%. 💄 Không cần vốn, không ôm hàng. Được đào tạo bán hàng từ A-Z.",1
Mày là cái loại đéo có liêm sỉ à? Ăn cắp bài của người khác còn già mồm.,0
Có ai biết cách xin giấy tạm hoãn nghĩa vụ quân sự không?,0
"Nhận thông tắc cống, bồn cầu. 🚽 Có mặt sau 15 phút. Xử lý triệt để, giá sinh viên.",1
"Thằng chó đấy vay tiền tao mấy tháng rồi đéo trả, gọi thì đéo nghe. Cay vcl.",0
"Mọi người ơi, quán net gần trường mình có chương trình khuyến mãi gì không ạ?",0
"Cái loại rẻ rách, đéo có tiền còn bày đặt sĩ diện.",0
"Bán tài khoản VIP cho các trang cá độ bóng đá. ⚽️ Tip kèo miễn phí, tỉ lệ thắng >85%. Ae xa bờ về đây với đội của mình.",1
"Đm cái thằng lồn nào đi SH để xe giữa sân KTX, bố mày đéo dắt xe ra được.",0
"Nhận làm assignment, project, báo cáo thực tập. ✍️ Giá sinh viên, đảm bảo qua môn. Ib để được báo giá chi tiết.",1
Học xong môn này tao thấy mình ngu như một con chó.,0
"Tuyển 10 bạn nữ livestream app X. Chỉ cần nói chuyện, ca hát. Thu nhập 10-20tr/tháng + quà tặng. Dr để phỏng vấn online.",1
Có ai biết chỗ nào bán ốc luộc ngon ở khu vực Thanh Xuân không?,0
Mày là cái loại đéo có não à? Nói chuyện như thằng thiểu năng.,0
"🔥 KEY WINDOWS 10/11 PRO, OFFICE 365 BẢN QUYỀN 🔥 Giá chỉ 99k, kích hoạt vĩnh viễn. Bảo hành 1 đổi 1. Dr ngay!",1
"Bạn muốn kiếm 200k/ngày chỉ bằng việc nghe nhạc? 🎧 App mới ra mắt, uy tín, rút tiền về Momo. Link tải ở bio.",1
Deadline dí sml mà thằng bạn cùng nhóm thì báo. Cay vcl.,0
Bán voucher nghỉ dưỡng Vinpearl 3N2Đ. 🏝️ Bao gồm vé máy bay + ăn sáng buffet. Giá rẻ hơn mua trực tiếp 50%.,1
Thằng chó đấy nợ tao 2 củ từ năm ngoái đến giờ chưa trả. Đm nó.,0
"Mọi người ơi, CLB Bóng chuyền có tuyển thành viên mới không ạ?",0
"Link group Zalo xem clip hot girl, sinh viên hằng ngày. Free cho 100 ae đầu tiên. 🥵",1
"Mày là cái loại súc vật, đéo phải con người.",0
"Nhận order Taobao, Pinduoduo không qua trung gian. 🚚 Hàng về nhanh, công mua hộ rẻ nhất thị trường.",1
Đm lại mất điện đúng lúc đang làm bài tập lớn. Đen như con chó.,0
Có ai có đề thi môn Mạng máy tính của K65 không cho em xin với ạ. 🙏,0
"Bạn đang gặp khó khăn về tài chính? 💸 Vay nóng 1-10 triệu, giải ngân trong 10 phút. Không cần gặp mặt, chỉ cần CMND.",1
"Cái loại bạn như mày, có cũng như không. Cút mẹ mày đi cho nước nó trong.",0
"Bán tài khoản Grammarly Premium, Turnitin check đạo văn. ✍️ Cần thiết cho ae sinh viên làm luận. Giá chỉ 30k/tháng.",1
Trượt phỏng vấn intern. Buồn vcl chúng mày ạ.,0
Thằng đấy gay lọ mà cứ tỏ ra men lì. Nhìn tởm vcl.,0
Chỉ 299k sở hữu ngay bí kíp đầu tư Forex cho người mới. 📈 Cam kết x2 tài khoản sau 1 tháng. Ib để nhận tài liệu.,1
Học phí kỳ này tăng nhiều quá. Bố mẹ ở nhà còng lưng ra lo tiền.,0
Mày nói chuyện nghe ngứa cả lồn.,0
"Pass lại con acc Tốc Chiến rank thách đấu, full tướng, 150 skin. Giá 1 củ khoai. Giao dịch trung gian.",1
Có ai đi xem Lễ hội âm nhạc Monsoon không? Lập team đi chung đi.,0
"Cái con ml đấy giả tạo vcl, trước mặt thì thảo mai sau lưng thì nói xấu.",0
Cái thằng óc cặc nào chấm bài tao môn Triết mà cho 5 điểm vậy? Bài làm dài vl mà điểm như cc.,0
"Bán tool hack map, hack lag Liên Quân Mobile. 🚀 Anti ban, an toàn tuyệt đối. Mua 1 lần dùng vĩnh viễn. Ib để nhận link cài.",1
Đm cái con chó nào ăn cắp cái sạc dự phòng của tao trên thư viện. Bố mày mà biết thì mày no đòn.,0
"VAY TÍN DỤNG ĐEN - GIẢI NGÂN SAU 5 PHÚT. 👹 Không cần thế chấp, không thẩm định. Chỉ cần CMND. Alo ngay 09xx.xxx.xxx",1
Có ai biết cách xin phúc khảo bài thi không? Tao chắc chắn con ml đấy chấm sai bài tao.,0
"YẾU SINH LÝ, RA NHANH? 💊 Kẹo ngậm cường dương kéo dài thời gian quan hệ. Hiệu quả ngay lần đầu. Kín đáo, an toàn. Dr để được tư vấn.",1
Học xong 4 năm chắc tao tổn thọ vì deadline mất. Mệt vcl.,0
Đứa nào có link tải Photoshop crack không cho tao xin với. Hết mẹ tiền rồi.,0
"Tuyển nhân viên seeding cho các sàn TMĐT. 💬 Chỉ cần cmt dạo, đánh giá 5 sao. 5k/cmt. Ib để nhận job.",1
"Cái thằng lồn đấy đá bóng như phá đám, cả đội gánh còng lưng.",0
"Nhận làm bằng Đại học, Cao đẳng, chứng chỉ ngoại ngữ. Phôi thật, tem thật, bao soi. 📜 Ib để trao đổi.",1
Mày là cái loại súc vật đéo có nhân tính à? Chuyện đấy mà cũng làm được.,0
"Đm con người yêu cũ, cắm sừng tao xong giờ lại đi kể xấu tao với bạn bè. Đúng là loại đĩ.",0
Bán đồ lót nữ sinh đã qua sử dụng. 👙 Mùi hương chân thật. Anh em có nhu cầu dr kín đáo nhé.,1
"Có ai biết quán bún đậu nào nhiều thịt, nhiều topping không ạ?",0
"Nhóm Zalo chia sẻ kèo bóng cỏ, tip nội gián. Tỉ lệ thắng 90%. ⚽️ Ae vào bờ cùng anh em mình.",1
"Mày nghĩ mày là ai mà dám chửi nó? Nhìn lại mình đi, con chó.",0
"Bán tài khoản Netflix, Spotify, Youtube Premium. 🎬 Đồng giá 30k/tháng. Bảo hành uy tín. Ib để chốt đơn.",1
"Thằng thầy dạy môn này vừa già vừa dê, toàn lựa mấy em xinh để hỏi bài.",0
Thi lại tốn tiền vcl. Đéo muốn xin tiền bố mẹ nữa.,0
"Bạn muốn kiếm 300k/ngày? Tải app ABC, nhập mã XYZ để nhận ngay 50k. 💸 Rút tiền về Momo sau 1 phút.",1
"Cái loại bạn như mày, tao đéo thèm chấp.",0
"Sim số đẹp, sim năm sinh. 📱 Giá sinh viên. Chọn số miễn phí. Ib mình để được tư vấn.",1
"Có ai đăng ký thi lại môn GDTC không, lập team ôn đi.",0
Con đĩ đấy cặp với đại gia mà cứ lên mạng rao giảng đạo đức. Tởm vcl.,0
"Dịch vụ viết thuê luận văn, đồ án tốt nghiệp. 🎓 Đội ngũ thạc sĩ, tiến sĩ nhiều kinh nghiệm. Cam kết điểm cao.",1
Đm thằng nào đi xe máy trong sân trường mà nẹt pô inh ỏi. Vô học.,0
Có ai biết cách fix lỗi font chữ trong slide không ạ?,0
Pass lại vé concert Taylor Swift tại Sing. 🎤 Do mình không sắp xếp được lịch bay. Giá gốc + phí đổi tên.,1
"Mày là cái thằng đần độn, não toàn tinh trùng à?",0
Học xong đói quá. Có đứa nào đi ăn với tao không?,0
"Cần tìm người share phòng trọ khu vực Mỹ Đình, 1tr8/người. Yêu cầu sạch sẽ, có ý thức.",0
"Bán tài khoản VIP các trang web cá độ, casino online. 🎰 Nạp 1 được 2. Hoàn trả không giới hạn. Ib để nhận link.",1
Đm cái thằng lồn nào lấy trộm đôi dép của tao ở trước cửa phòng. Bố mày mà biết thì mày chết mẹ.,0
"NHẬN LÀM GIẤY KHÁM SỨC KHỎE, GIẤY NGHỈ ỐM HƯỞNG BHXH. 📄 Dấu đỏ bệnh viện, ship hỏa tốc. Ib Zalo để được tư vấn.",1
"Mày là cái loại súc vật, bạn bè khó khăn đéo giúp được đồng nào còn quay ra cắn. Cút mẹ mày đi.",0
"Link group Telegram tổng hợp clip drama, phốt của các hot girl. 🔞 Full không che. Link ở bio, free 50 slot đầu.",1
Học xong môn này tao thấy não mình như bị teo lại. Đéo hiểu giảng cái lồn gì.,0
"Bạn muốn kiếm 500k-1tr/ngày? 💸 Tham gia nhóm đầu tư tài chính 4.0. Chuyên gia đọc lệnh, cam kết lợi nhuận. Ib mình để vào nhóm.",1
Có ai có đề cương ôn thi môn Lịch sử Đảng không cho mình xin với. 🙏,0
"Dịch vụ đòi nợ thuê cho sinh viên. 👹 Lấy lại tiền từ những thằng bạn chó má. Nhanh gọn, kín đáo. Liên hệ Zalo...",1
"Con đĩ đấy thảo mai vcl, trước mặt thì ngon ngọt sau lưng thì nói xấu như chó.",0
"Tuyển 15 bạn nữ livestream app hẹn hò. Chỉ cần xinh, nói chuyện có duyên. Lương 15-30tr/tháng. Dr để phỏng vấn.",1
Cái thằng óc cặc đấy đá bóng ngu như lợn mà cứ thích thể hiện.,0
Đm lại hết tiền ăn. Kiếp sinh viên khổ vcl.,0
"TOOL BUFF MẮT LIVESTREAM, TĂNG TƯƠNG TÁC. 🚀 Giúp bạn bán hàng nghìn đơn. Giá chỉ 199k/tháng. Ib để được dùng thử.",1
Có ai biết cách fix lỗi máy tính tự động restart không ạ?,0
"Bán tài khoản Canva Pro, Grammarly, Quillbot. ✍️ Đồng giá 30k/tháng. Hỗ trợ học tập, làm luận hiệu quả.",1
Mày là cái loại đéo có não à? Đăng cái status ngu lồn.,0
Thi lại môn Triết học. Cay đéo tả được.,0
"Pass lại vé xem show của Lệ Quyên. 🎤 Do mình có việc bận. Vị trí đẹp, giá gốc.",1
"Thằng thầy dạy môn này hãm lồn vcl, toàn trù sinh viên.",0
"YẾU SINH LÝ, CHƯA ĐẾN CHỢ ĐÃ HẾT TIỀN? 💊 Kẹo ngậm thảo dược, kéo dài cuộc yêu. Kín đáo, hiệu quả. Dr ngay.",1
Có đứa nào biết info con bé xinh vãi lồn khoa Marketing mới vào không?,0
Bạn đang cần tiền gấp? 💰 VAY TIỀN ONLINE không cần gặp mặt. Chỉ cần ảnh CMND. Duyệt hồ sơ trong 5 phút.,1
Đứa nào có link torrent bộ phim The Boys mùa mới không cho tao xin.,0
"Cái loại bạn như mày, sống chỉ thêm chật đất. Cút.",0
"Nhận cày thuê rank LMHT, Valorant. 🎮 Kéo rank thần tốc, giá sinh viên. Uy tín, bảo mật acc.",1
Học xong đói vcl. Có đứa nào đi ăn đêm với tao không?,0
Con ml đấy vừa xấu vừa vô duyên mà cũng có người yêu. Đúng là nồi nào úp vung nấy.,0
Deadline dí đến đít rồi mà máy tính hỏng. Đen như con chó mực.,0
Đm cái thằng chó nào ném rác qua ban công phòng tao. Bố mày mà bắt được thì mày xác định.,0
"🔥 TOOL HACK TÀI XỈU, BACCARAT ONLINE 🔥 Tỷ lệ thắng 98%. Giúp anh em về bờ an toàn. Ib để được cài đặt và hướng dẫn.",1
"Mày là cái loại bạn bè đéo gì thế? Thấy tao có người yêu là quay ra ghen ăn tức ở à, con đĩ.",0
"Tuyển nhân viên nhập mã captcha tại nhà. 💻 Việc nhẹ lương cao, 200-300k/ngày. Rút tiền về tài khoản ngân hàng. Ib để nhận việc.",1
Có ai biết chỗ nào bán bánh mì dân tổ ngon không? Sáng mai tao phải đi học sớm.,0
"Nhận làm bằng tốt nghiệp, học bạ, chứng chỉ Tiếng Anh. 📜 Phôi thật 100%, bao công chứng. Kín đáo, uy tín. Dr Zalo...",1
"Cái thằng lồn dạy môn thể dục, vừa dê vừa hãm, toàn lựa mấy em xinh để nắn bóp.",0
"Bán tài khoản VIP các app hẹn hò Tinder, Bumble. 💘 Tăng match, auto swipe. Giúp ae FA tìm gấu. Giá chỉ 49k/tháng.",1
Mày nói chuyện nghe như một thằng bại não vậy. Cút mẹ mày đi cho trong lành.,0
Thi xong môn cuối rồi chúng mày ơi. Xõa thôi. 🎉,0
Bạn muốn kiếm tiền thụ động? 💸 Tham gia hệ thống affiliate marketing của chúng tôi. Hoa hồng lên đến 50%. Link đăng ký ở bio.,1
"Con ml đấy sống lỗi vcl, vay tiền cả phòng xong bùng mẹ luôn.",0
Học xong ngành này ra trường đéo biết làm cái lồn gì. Chán vcl.,0
Pass lại vé xe về quê ăn Tết. 🚌 Giường nằm Limousine. Do mình được nghỉ sớm hơn. Giá gốc.,1
Có ai có link tải game God of War crack không cho tao xin với. 🙏,0
Cái loại rẻ rách như mày thì chỉ xứng đáng dùng hàng fake thôi.,0
"Tuyển sugar baby, sinh viên năm 1, 2. Ngoan, biết nghe lời. Daddy chu cấp 20 củ/tháng. Dr info + ảnh kín đáo.",1
Đm lại phải đóng tiền học phí rồi. Xót cả ruột.,0
Mày là cái thằng óc chó à? Bài dễ thế mà cũng đéo làm được.,0
"Nhận thi hộ, điểm danh hộ tất cả các môn. ✍️ Đội ngũ SV giỏi, cam kết qua môn. Bảo mật thông tin tuyệt đối.",1
Thằng thầy dạy môn C++ giảng như cái cặc. Đéo hiểu con mẹ gì cả.,0
"Bán acc Tiktok 100k follow. 🚀 Tương tác thật, phù hợp cho ae bán hàng online. Giao dịch trung gian.",1
Deadline ngập đến cổ rồi. Cứu tao với chúng mày ơi.,0
"Con đĩ đấy suốt ngày lên mạng sống ảo, chứ ngoài đời thì xấu như ma.",0
"Bạn đang bị nám, tàn nhang? ✨ Kem trị nám gia truyền, hiệu quả sau 1 liệu trình. Cam kết hoàn tiền nếu không đỡ.",1
Có đứa nào đi xem giải bóng đá sinh viên chiều nay không?,0
"Mày là cái loại súc vật, đéo có đạo đức à?",0
"Nhận order quần áo, giày dép Quảng Châu. 👕 Hàng về sau 5-7 ngày. Công mua hộ rẻ nhất Vịnh Bắc Bộ.",1
Thằng bạn cùng phòng ở bẩn như một con lợn. Quần sịp vứt lung tung. Tởm vcl.,0
Mày bớt sủa đi được không? Nghe nhức cả đầu.,0
"Bán tài khoản ChatGPT 4.0, Midjourney. 🤖 Hỗ trợ anh em sinh viên chạy deadline, làm đồ án. Giá chỉ 50k/tháng.",1
"Đm thằng nào đi xe bus không có ý thức, chen lấn xô đẩy như một con súc vật.",0
"Cần tìm người share tiền thuê sân bóng chiều mai. Sân 7, 150k/giờ. Thiếu 3 người.",0
"Bạn muốn kiếm 1-2 củ/tuần? 💰 Tuyển CTV chốt đơn hàng thời trang. Không cần vốn, làm tại nhà. Ib để được training.",1
Con ml đấy được học bổng chắc lại đi ngủ với thầy giáo chứ học hành cc gì.,0
"VAY TIỀN CHỈ CẦN THẺ SINH VIÊN. 🔥 Lãi suất thấp, giải ngân trong 5 phút. Không gọi điện cho người nhà. Bấm vào link ở bio.",1
Thằng lồn nào lấy trộm cái mũ bảo hiểm của tao ở nhà xe. Bố mày mà thấy thì mày ăn cặc.,0
"Nhận làm chứng chỉ Tin học, Tiếng Anh quốc gia. 📜 Bao soi, bao công chứng. Uy tín, kín đáo. Dr Zalo để trao đổi.",1
Mày là cái loại bạn bè đéo gì mà thấy tao bị chửi đéo bênh được một câu? Hèn như chó.,0
"Tuyển sugar baby ngoan, kín đáo. Daddy lo chu cấp full từ A-Z, 25 củ/tháng. Yêu cầu ngoại hình ưa nhìn. 🌹",1
Học xong môn này tao thấy mình đần độn hẳn ra. Đéo hiểu thầy giảng cái lồn gì.,0
Link group Zalo xem clip xxx của các em gái sinh viên. 🥵 Free slot cho 200 ae đầu tiên. Link ở bio.,1
Đm lại phải học lại. Tốn tiền của bố mẹ vcl.,0
Cái con đĩ đấy xấu như ma chê quỷ hờn mà suốt ngày đăng ảnh câu like.,0
Bán tài khoản Netflix Premium 4K. 🎬 Xem phim không giới hạn. Giá chỉ 40k/tháng. Bảo hành full time.,1
Có ai biết chỗ nào bán phở cuốn ngon ở khu vực Cầu Giấy không?,0
Mày là cái thằng óc lợn à? Nói mãi mà đéo hiểu à?,0
"TOOL AUTO LIKE, CMT, SHARE FACEBOOK. 🚀 Giúp bạn kéo tương tác, bán hàng hiệu quả. Giá sinh viên. Ib để dùng thử.",1
"Thằng thầy dạy môn này hãm vcl, suốt ngày đạo lý.",0
"Nhận cày thuê Elo, rank game Tốc Chiến, Liên Quân. 🎮 Kéo rank thần tốc, giá rẻ. Uy tín, không phá acc.",1
Deadline dí đến đít rồi mà mất mẹ nó mạng. Cay vcl.,0
Mày câm mẹ cái mồm thối của mày vào đi.,0
"Bạn đang bí ý tưởng làm bài tập lớn? 🔥 Bán 1000+ báo cáo, đồ án các ngành kinh tế, kỹ thuật. Giá chỉ từ 50k/bài.",1
Có đứa nào đi xem Ravolution Music Festival không? Lập team đi cho vui.,0
Cái loại rẻ rách như mày thì đéo có tư cách nói chuyện với tao.,0
"Nhận order hàng US, UK. ✈️ Cam kết auth, full bill. Công mua hộ rẻ. Hàng về sau 2-3 tuần.",1
"Thằng bạn cùng phòng ở bẩn như lợn, bát đũa ăn xong đéo rửa. Tởm vcl.",0
Có ai biết cách xin gia hạn học phí không ạ? Nhà em đang có việc.,0
Pass lại con acc Valorant nhiều skin súng. Rank Vàng. Do không có thời gian chơi. Giá 5 lít.,1
"Học xong đói quá, có đứa nào đi ăn đêm không?",0
Ae cho hỏi build PC tầm 20 củ thì nên đi chip Intel hay AMD nhỉ? Nhu cầu vừa game vừa code.,0
"🔥 BÁN DATA 5000 SINH VIÊN CÁC TRƯỜNG TPHCM 🔥 Full info (SĐT, email, trường, ngành). Phù hợp cho ae chạy sale, marketing. Ib kín.",1
"Tối nay MU đá, thằng nào fan MC thì câm mẹ mồm vào nhé.",0
"Nhận unlock iCloud, bypass iPhone, iPad. 📱 Nhanh chóng, giá rẻ. Hỗ trợ mọi đời máy. Dr để được tư vấn.",1
Con laptop của tao vừa hết bảo hành thì lăn ra hỏng main. Đm đúng là số chó.,0
"Tuyển 30 bạn làm việc tại nhà. Chỉ cần copy-paste, thu nhập 2-4tr/tháng. 💻 Không yêu cầu kinh nghiệm. Ib mình để nhận JD.",1
"Mọi người ơi, thủ tục xin cấp lại thẻ sinh viên bị mất có phức tạp không ạ?",0
Bàn phím cơ switch brown gõ sướng thật sự. Êm hơn hẳn con blue cũ của tao.,0
"Link group kín Zalo chia sẻ clip 2k4, 2k5. 🥵 Full HD không che. Vào nhanh trước khi full slot. Link ở bio.",1
Mày là cái loại bạn bè đéo gì mà thấy tao bị bắt nạt thì trốn như chó?,0
Học ngành IT năm nhất thì nên mua laptop nào tầm 15 củ vậy mng?,0
"Bạn muốn kiếm 500k/ngày? 💸 Tham gia hệ thống TÀI XỈU của chúng tôi. Kéo 1-1, cam kết thắng lớn. Add Zalo để vào nhóm.",1
Thằng lồn đấy đá bóng ngu như lợn mà cứ thích cầm bóng đột phá.,0
"Pass lại con chuột Logitech G Pro X Superlight. Hơi cũ, bị double click. Giá 3 lít cho ae về sửa.",0
"Dịch vụ viết thuê, chạy deadline các môn đại cương. ✍️ Nhanh, rẻ, uy tín. Cứu ae qua mùa thi cử.",1
Idol của chúng mày đấy à? Nhìn như thằng nghiện. 😂,0
"Có ai biết chỗ nào vệ sinh laptop, tra keo tản nhiệt uy tín ở Hà Nội không ạ?",0
"Bán tài khoản VIP các trang phim người lớn. 🔞 Full thể loại, không quảng cáo. Kín đáo, an toàn.",1
"Đm cái thằng bạn cùng phòng, đêm thì ngáy như sấm, sáng thì đéo dậy tắt báo thức.",0
Có ai biết cách cài Win 11 không bị lỗi không?,0
"Nhận làm bằng tốt nghiệp, chứng chỉ IELTS 7.0+. 📜 Phôi thật, bao soi. Giúp bạn có CV đẹp. Ib để trao đổi.",1
"Mọi người ơi, học bổng khuyến khích học tập đã có kết quả chưa ạ?",0
"Cái loại rẻ rách, mở mồm ra là điêu.",0
"VAY TIỀN ONLINE - CHỈ CẦN CMND. 💰 Không thẩm định, không gọi người thân. Duyệt vay trong 3 phút. Tải app tại...",1
"Em là nữ, đang phân vân giữa Dell XPS và Macbook Air M1. Nhu cầu văn phòng, giải trí nhẹ nhàng. Nhờ mn tư vấn.",0
Thằng chó đấy vay tiền tao mua bàn phím cơ xong bùng mẹ luôn. Cay.,0
"Tuyển sugar baby, chu cấp 15 củ/tháng. Yêu cầu ngoan, biết chiều. Daddy ở Hà Nội. Dr info kín.",1
Tối nay có ai xem C1 không? Real Madrid chấp mấy quả nhỉ?,0
"Bạn cùng nhóm làm ăn như cái lồn, deadline đến đít rồi mà slide còn chưa xong.",0
"Bán acc Steam full game AAA. 🎮 GTA V, Cyberpunk, Elden Ring... Giá chỉ 500k. Giao dịch qua trung gian.",1
Có ai biết chỗ nào bán ram laptop cũ giá rẻ không?,0
Con đĩ đấy cặp với cả khoa mà cứ tỏ ra mình là gái nhà lành. Tởm vcl.,0
"Nhận order phụ kiện PC (VGA, RAM, SSD) từ Amazon, Newegg. ✈️ Hàng về nhanh, giá tốt hơn trong nước.",1
"Đm mạng wifi ktx như cc, xem youtube 360p còn giật.",0
Mọi người cho em hỏi học ngành an toàn thông tin ra trường có dễ xin việc không ạ?,0
Nhà bạn chắc không có gì ngoài điều kiện nhỉ? Thấy đổi điện thoại liên tục.,0
"Bán tài khoản Office 365, Google Drive không giới hạn dung lượng. 💾 Lưu trữ tài liệu an toàn. Giá 100k/năm.",1
"Thua độ trận bóng tối qua, cay như dái.",0
Mày là cái thằng óc lợn à? Code sai logic mà cứ thích cãi.,0
Có ai biết cách cài dual boot Windows và Ubuntu không bị mất dữ liệu không?,0
"Bạn muốn x5, x10 tài khoản? 🚀 Tham gia nhóm tín hiệu coin của chúng tôi. Hoàn toàn miễn phí. Link Zalo ở bio.",1
Chạy xong cái đồ án này chắc tao đi tu.,0
Cần tìm người share acc ChatGPT Plus dùng chung.,0
